{
  "achieved_proof": [
    {
      "evidence": [
        {
          "record_id": "ART-WAH-VERIFICATION",
          "record_type": "artifact"
        }
      ],
      "kind": "local-implementation",
      "limitations": [
        "The conformance catalog was not executed against an external model; runtime/schema issue implementations remain open."
      ],
      "non_vacuity_check": "The new tests assert each incident seam and the full runtime suite exercises the public CLI and persisted records.",
      "observed_at": "2026-09-16T15:39:06.4842629Z",
      "observed_by": {
        "actor_id": "agent:workbench",
        "kind": "agent"
      },
      "oracle": {
        "description": "Pytest reported 89 passes; Workbench, skill packaging, Skill Creator, and diff validators passed.",
        "kind": "automated-independent"
      },
      "requirement_id": "REQ-WAH-LOCAL",
      "result": "passed",
      "verification_target": {
        "environment": "local-repository",
        "journey": "audit-evidence-to-guardrails-issues-and-evals",
        "seam": "workbench-skill-cli-and-eval-contract"
      }
    }
  ],
  "applicability": "required",
  "claim": "The bounded Workbench skill patch, local runtime issue set, and conformance eval contract are locally implemented and verified.",
  "created_at": "2026-09-16T15:39:06.4842629Z",
  "owner": {
    "actor_id": "agent:workbench",
    "kind": "agent"
  },
  "proof_id": "PRF-WAH-LOCAL",
  "record_type": "workbench-proof",
  "required_proof": [
    {
      "acceptance_criteria": [
        "The three Workbench guardrails are present without exceeding the entrypoint budget.",
        "The three local runtime issues contain invariants, proposed contracts, acceptance criteria, and regression coverage.",
        "The six incident-derived conformance cases satisfy their executable contract checks.",
        "The full Workbench runtime and repository validators pass."
      ],
      "description": "Verify the skill guardrails, issue records, conformance cases, runtime compatibility, and package structure.",
      "kind": "local-implementation",
      "oracle_requirement": "Independent pytest and repository validators report non-vacuous passing results.",
      "requirement_id": "REQ-WAH-LOCAL",
      "verification_target": {
        "environment": "local-repository",
        "journey": "audit-evidence-to-guardrails-issues-and-evals",
        "seam": "workbench-skill-cli-and-eval-contract"
      }
    }
  ],
  "schema_version": "0.5.0",
  "status": "passed",
  "updated_at": "2026-09-16T15:39:06.4842629Z",
  "verification_scope": "feature-focused",
  "work_id": "WB-20260916-WORKBENCH-ADHERENCE-HARDENING"
}
